{
  "id": "notion-chromium-caches",
  "tool": "Notion",
  "locations": [
    {
      "platforms": ["macos"],
      "root": { "kind": "home" },
      "path": "Library/Application Support/Notion/Cache"
    },
    {
      "platforms": ["macos"],
      "root": { "kind": "home" },
      "path": "Library/Application Support/Notion/Code Cache"
    },
    {
      "platforms": ["macos"],
      "root": { "kind": "home" },
      "path": "Library/Application Support/Notion/GPUCache"
    },
    {
      "platforms": ["macos"],
      "root": { "kind": "home" },
      "path": "Library/Application Support/Notion/DawnGraphiteCache"
    },
    {
      "platforms": ["macos"],
      "root": { "kind": "home" },
      "path": "Library/Application Support/Notion/DawnWebGPUCache"
    },
    {
      "platforms": ["macos"],
      "root": { "kind": "home" },
      "path": "Library/Application Support/Notion/Partitions/*/Cache"
    },
    {
      "platforms": ["macos"],
      "root": { "kind": "home" },
      "path": "Library/Application Support/Notion/Partitions/*/Code Cache"
    },
    {
      "platforms": ["macos"],
      "root": { "kind": "home" },
      "path": "Library/Application Support/Notion/Partitions/*/GPUCache"
    },
    {
      "platforms": ["macos"],
      "root": { "kind": "home" },
      "path": "Library/Application Support/Notion/Partitions/*/DawnGraphiteCache"
    },
    {
      "platforms": ["macos"],
      "root": { "kind": "home" },
      "path": "Library/Application Support/Notion/Partitions/*/DawnWebGPUCache"
    },
    {
      "platforms": ["windows"],
      "root": { "kind": "roaming_app_data" },
      "path": "Notion/Cache"
    },
    {
      "platforms": ["windows"],
      "root": { "kind": "roaming_app_data" },
      "path": "Notion/Code Cache"
    },
    {
      "platforms": ["windows"],
      "root": { "kind": "roaming_app_data" },
      "path": "Notion/GPUCache"
    },
    {
      "platforms": ["windows"],
      "root": { "kind": "roaming_app_data" },
      "path": "Notion/DawnGraphiteCache"
    },
    {
      "platforms": ["windows"],
      "root": { "kind": "roaming_app_data" },
      "path": "Notion/DawnWebGPUCache"
    },
    {
      "platforms": ["windows"],
      "root": { "kind": "roaming_app_data" },
      "path": "Notion/Partitions/*/Cache"
    },
    {
      "platforms": ["windows"],
      "root": { "kind": "roaming_app_data" },
      "path": "Notion/Partitions/*/Code Cache"
    },
    {
      "platforms": ["windows"],
      "root": { "kind": "roaming_app_data" },
      "path": "Notion/Partitions/*/GPUCache"
    },
    {
      "platforms": ["windows"],
      "root": { "kind": "roaming_app_data" },
      "path": "Notion/Partitions/*/DawnGraphiteCache"
    },
    {
      "platforms": ["windows"],
      "root": { "kind": "roaming_app_data" },
      "path": "Notion/Partitions/*/DawnWebGPUCache"
    }
  ],
  "safety_class": "regenerable",
  "regeneration": { "effort": "seconds", "network": true },
  "sources": [
    "https://www.notion.com/help/reset-notion",
    "https://www.electronjs.org/docs/latest/api/app",
    "https://www.electronjs.org/docs/latest/api/session",
    "https://github.com/electron/electron/blob/main/shell/browser/net/network_context_service.cc",
    "https://github.com/electron/electron/blob/main/shell/browser/electron_browser_context.cc",
    "https://github.com/chromium/chromium/blob/main/chrome/common/chrome_constants.h",
    "https://www.chromium.org/developers/design-documents/network-stack/disk-cache/",
    "https://github.com/chromium/chromium/blob/main/content/browser/storage_partition_impl.cc",
    "https://github.com/chromium/chromium/blob/main/gpu/ipc/common/gpu_disk_cache_type.cc"
  ],
  "last_verified": "2026-10-26"
}
